"id","levelId","levelName","paperName","question","optionA","optionB","optionC","optionD","answer","answerIndex","explanation","enabled"
"lesson8-第八課-陋室銘-小卷-1","lesson8","第八課 陋室銘","第八課 陋室銘 小卷","下列「 」中的字，何者前後讀音不同？","褻「瀆」神明／初生之「犢」","初出茅「廬」／「蘆」筍汁","物美價「廉」／垂「簾」聽政","「糯」米飯糰／相「濡」以沫","D","3","(A)ㄉㄨˊ(B)ㄌㄨˊ(C)ㄌㄧㄢˊ(D)ㄋㄨㄛˋ／ㄖㄨˊ","TRUE"
"lesson8-第八課-陋室銘-小卷-2","lesson8","第八課 陋室銘","第八課 陋室銘 小卷","下列「 」中的「素」字，何者為「一向的、平日的」之義？","「素」行不良","留蚊於「素」帳中","尸位「素」餐","穿著樸「素」","A","0","(B)白色的(C)空的、平白的(D)不加雕飾的","TRUE"
"lesson8-第八課-陋室銘-小卷-3","lesson8","第八課 陋室銘","第八課 陋室銘 小卷","下列倒裝句語序還原的對應，何者有誤？","何難之有→難有何事","菊之愛→愛菊","馬首是瞻→瞻馬首","唯兄嫂是依→唯依兄嫂","A","0","(A)有何難","TRUE"
"lesson8-第八課-陋室銘-小卷-4","lesson8","第八課 陋室銘","第八課 陋室銘 小卷","下列借代事物與借代本體的配對，何者正確？","東道主：女婿","梨園子弟：富貴人家子弟","「杏壇」之光：教育界","造福「桑梓」：國家","C","2","(A)主人(B)演藝人員(D)故鄉家園","TRUE"
"lesson8-第八課-陋室銘-小卷-5","lesson8","第八課 陋室銘","第八課 陋室銘 小卷","下列文句，何者有冗言贅字？","他向來勤奮努力，深受同學敬重","這幅畫的色調繁多豐富，極為搶眼","弟弟天真爛漫，常常逗得大家哈哈大笑","我們必須認真準備，迎接即將到來的考試","B","1","(B)「繁多」、「豐富」擇一刪","TRUE"
"lesson8-第八課-陋室銘-小卷-6","lesson8","第八課 陋室銘","第八課 陋室銘 小卷","「山不在高，有仙則名；水不在深，有龍則靈。」關於這段話的理解，下列何者正確？","山水是否出名，全在於外型壯麗","居住的地方能因居住者的德行而有價值","山水必須高深，才會有神仙居住","只有仙人、龍神，才能使人獲得名聲","B","1","作者以山水比喻居室，指出地位或外觀並不重要，真正重要的是居住者的品德，故選(B)","TRUE"
"lesson8-第八課-陋室銘-小卷-7","lesson8","第八課 陋室銘","第八課 陋室銘 小卷","「斯是陋室，惟吾德馨。」本句話的寓意最接近下列何者？","陋室雖小，但因景色優美而可貴","陋室清靜，才會讓人忘卻世俗煩惱","陋室簡陋，卻因主人品德而不陋","陋室孤寂，反而讓人心情沉澱思索","C","2","「惟吾德馨」是全文核心，強調德行可使陋室不陋，故選(C)","TRUE"
"lesson8-第八課-陋室銘-小卷-8","lesson8","第八課 陋室銘","第八課 陋室銘 小卷","「無絲竹之亂耳，無案牘之勞形」主要反映了作者對生活的什麼態度？","追求官場功名，為民奔走辛勞","崇尚幽靜生活，不慕權勢繁華","喜愛音樂宴樂，時常陶醉其中","熱衷政務公文，十分樂在其中","B","1","此處強調沒有嘈雜樂音與公務文件干擾，反映作者珍惜閒適幽靜的生活，故選(B)","TRUE"
"lesson8-第八課-陋室銘-小卷-9","lesson8","第八課 陋室銘","第八課 陋室銘 小卷","下列敘述，何者最貼近作者寫「南陽 諸葛廬，西蜀 子雲亭」的用意？","作者羨慕前人居住豪華住宅","作者引用古人事蹟，增加文章氣勢","作者批評諸葛亮與揚雄隱居無用","作者自比前賢，冀望志業有成","D","3","作者藉由歷史人物的居所，表明自己品德才華可與前賢比肩，並期待未來有所作為，故選(D)","TRUE"
"lesson8-第八課-陋室銘-小卷-10","lesson8","第八課 陋室銘","第八課 陋室銘 小卷","關於陋室銘的寫作手法，下列敘述何者正確？","全文多以散句為主，句式雜亂無章","文章僅寫景抒情，沒有議論鋪陳","文中多用對偶句，音韻和諧節奏明快","主要依靠華麗詞藻，展現奢華氣勢","C","2","(A)除了最後一句是散句，其餘皆為對偶句，並不雜亂(B)全文除了寫景抒情，還有議論(D)文章不以華麗詞藻為主","TRUE"
"lesson8-第八課-陋室銘-1","lesson8","第八課 陋室銘","第八課 陋室銘","下列「 」內的「丁」字，何者不是指人？","目不識「丁」","庖「丁」解牛","人「丁」單薄","往來無白「丁」","A","0","(A)字，比喻極易認識的字","TRUE"
"lesson8-第八課-陋室銘-2","lesson8","第八課 陋室銘","第八課 陋室銘","下列哪個「之」字的詞性，和「何陋之有」的「之」字不同？","無絲竹「之」亂耳","無案牘「之」勞形","蓮「之」愛，同予者何人","學而時習「之」，不亦說乎","D","3","題幹與(A)(B)(C)助詞。(D)代詞","TRUE"
"lesson8-第八課-陋室銘-3","lesson8","第八課 陋室銘","第八課 陋室銘","下列「 」中的字，何者用來表示真正的顏色？","草色入簾「青」","往來無「白」丁","可以調「素」琴","閱「金」經","A","0","(B)指不識字的(C)不加雕飾的(D)珍藏的","TRUE"
"lesson8-第八課-陋室銘-4","lesson8","第八課 陋室銘","第八課 陋室銘","「山不在高，有仙則名；水不在深，有龍則靈。」有關這四句的暗喻，下列何者說明正確？","以「山」、「水」比喻作者自己","以「仙」、「龍」比喻陋室","以「山」、「仙」比喻作者自己，以「水」、「龍」比喻陋室","以「山」、「水」比喻陋室，以「仙」、「龍」比喻作者自己","D","3","以「山」、「水」比喻居室；「仙」、「龍」比喻有品德、學識的人，暗指自己，故選(D)","TRUE"
"lesson8-第八課-陋室銘-5","lesson8","第八課 陋室銘","第八課 陋室銘","「苔痕上階綠」除了顯現陋室生意盎然之外，還有下列哪種暗示？","少有訪客","天常陰雨","住處偏遠","交通不便","A","0","(A)由於少有訪客，才會綠苔滿階","TRUE"
"lesson8-第八課-陋室銘-6","lesson8","第八課 陋室銘","第八課 陋室銘","「談笑有鴻儒，往來無白丁。」這二句是借客人來襯托主人的何種人格特質？","一意孤行","目空一切","高傲不群","高雅脫俗","D","3","以客人的庸俗襯托主人的高雅脫俗，才德兼備，故選(D)","TRUE"
"lesson8-第八課-陋室銘-7","lesson8","第八課 陋室銘","第八課 陋室銘","「孔子云：『何陋之有？』」作者在這句話之前，其實還隱藏了下列何句？","有仙則名","君子居之","斯是陋室","惟吾德馨","B","1","出自論語 子罕：「子曰：『君子居之，何陋之有？』」故選(B)","TRUE"
"lesson8-第八課-陋室銘-8","lesson8","第八課 陋室銘","第八課 陋室銘","下列「 」中的字，何者字形應用錯誤？","以身作「則」","「鴻」圖大展","舐「牘」情深","毫無瓜「葛」","C","2","(C)舐「牘」情深→犢","TRUE"
"lesson8-第八課-陋室銘-9","lesson8","第八課 陋室銘","第八課 陋室銘","下列有關陋室銘一文的敘述，何者正確？","本文句子全採對仗形式","本文以「惟吾德馨」貫串全文","開頭四句點明題旨，採用破題法","押韻字有「名、靈、青、丁、經、形、亭」","B","1","(A)並非通篇對仗(C)開頭六句(D)名、靈、馨、青、丁、經、形、亭","TRUE"
"lesson8-第八課-陋室銘-10","lesson8","第八課 陋室銘","第八課 陋室銘","諸葛亮 出師表：「臣本布衣，躬耕於南陽，全性命於亂世，不求聞達於諸侯。」由上文可知，諸葛亮的出身為何？","貴族","富商","平民","奴隸","C","2","「布衣」原指古代平民所穿的衣服，後借代為平民，故選(C)","TRUE"
"lesson8-第八課-陋室銘-11","lesson8","第八課 陋室銘","第八課 陋室銘","下列「 」中的字，何者音義的說明完全正確？","「斯」是陋室：音ㄙ，這、此","談笑有「鴻」儒：音ㄏㄨㄥˊ，知名度很高","可以「調」素琴：音ㄉㄧㄠˋ，彈奏、撫弄","案「牘」：音ㄉㄨˊ，書桌","A","0","(B)大(C)音ㄊㄧㄠˊ(D)書寫文字的木片","TRUE"
"lesson8-第八課-陋室銘-12","lesson8","第八課 陋室銘","第八課 陋室銘","岳飛常為公務煩心，請問下列哪一個詞語不適合形容他為公務所操勞？","案牘勞形","絲竹亂耳","日理萬機","塵務經心","B","1","(C)形容工作非常繁重(D)俗事纏繞於心","TRUE"
"lesson8-第八課-陋室銘-13","lesson8","第八課 陋室銘","第八課 陋室銘","下列各句「 」中的字，何者詞性前後相同？","無絲竹之「亂」耳，無案牘之勞「形」","斯是「陋」室，惟「吾」德馨","水不在「深」，有龍則「靈」","南陽 諸葛「廬」，西蜀 子雲「亭」","D","3","(A)動詞／名詞(B)形容詞／代詞(C)形容詞／動詞(D)名詞","TRUE"
"lesson8-第八課-陋室銘-14","lesson8","第八課 陋室銘","第八課 陋室銘","下列文句，何者用字完全正確？","農夫在田裡忙插秧，汗流夾背也無法休息","這道數學題實在太難，小老師也一籌莫展","本學期的模範生選舉，正如火如茶地展開","他對什麼事都寞不關心，簡直是麻木不仁","B","1","(A)汗流「夾」背→浹(C)如火如「茶」→荼(D)「寞」不關心→漠","TRUE"
"lesson8-第八課-陋室銘-15","lesson8","第八課 陋室銘","第八課 陋室銘","由「南陽 諸葛廬，西蜀 子雲亭」二句，可推知作者的何種心意？","曲高和寡，孤芳自賞","見賢思齊，待機而出","熱衷名利，不甘黯淡","離群索居，與世隔絕","B","1","題幹暗示自己和孔明、揚雄一樣靜待時機，以期一展抱負，名留青史，故選(B)","TRUE"
"lesson8-第八課-陋室銘-16","lesson8","第八課 陋室銘","第八課 陋室銘","「可以調素琴，閱金經。無絲竹之亂耳，無案牘之勞形。」這段文字主要說明了下列何種情景？","陋室不受親朋好友的打擾","陋室的藏書十分豐富","陋室主人能力足以獨當一面","陋室主人的悠閒自在","D","3","(A)是指不受到俗世應酬的干擾(B)未提及(C)此句未提及與能力相關的內容","TRUE"
"lesson8-第八課-陋室銘-17","lesson8","第八課 陋室銘","第八課 陋室銘","「何陋之有」是倒裝句，下列何者也使用了這種句型？","常射於家圃","舌一吐而二蟲盡為所吞","甚矣，汝之不惠","三人行，必有我師焉","C","2","(C)還原：汝之不惠甚矣","TRUE"
"lesson8-第八課-陋室銘-18","lesson8","第八課 陋室銘","第八課 陋室銘","下列句型的說明，何者不正確？","苔痕上階綠：表態句","草色入簾青：敘事句","往來無白丁：有無句","閱金經：敘事句","A","0","(A)敘事句","TRUE"
"lesson8-第八課-陋室銘-19","lesson8","第八課 陋室銘","第八課 陋室銘","讀完陋室銘，芝芝夢到自己在劉禹錫的書房參觀，她在汗牛充棟的書房中發現一本不可能出現的書，請問這本書應為下列何者？","許慎的說文解字","劉義慶的世說新語","蕭統的昭明文選","歐陽脩的歐陽文忠公全集","D","3","劉禹錫生於唐代，不可能讀過宋代 歐陽脩的著作，故選(D)。(A)東漢(B)魏晉南北朝(C)魏晉南北朝","TRUE"
"lesson8-第八課-陋室銘-20","lesson8","第八課 陋室銘","第八課 陋室銘","詩云：「時人莫小池中水，淺處無妨有臥龍。」此與陋室銘中的哪一句意思相通？","斯是陋室，惟吾德馨","往來無白丁","無案牘之勞形","苔痕上階綠","A","0","題幹與(A)都表達即使處於簡陋或淺小的環境，也可能因其中具有不凡價值而不平凡。「淺處無妨有臥龍」呼應「斯是陋室，惟吾德馨」，所以選(A)。","TRUE"
"lesson8-第八課-陋室銘-21","lesson8","第八課 陋室銘","第八課 陋室銘","「綠建築是指：消耗最少地球能源及資源，製造最少廢棄物，具有生態、節能，健康特性與減廢的建築物。必須是以人生活的健康、舒適為原點，對於居住環境進行全面性、系統性的環保設計。」下列關於綠建築的敘述，何者正確？","綠建築多使用植物做為建材，呈現多樣化的生態","綠建築多為了客製化，以小空間設計為主","綠建築主打耐久性，建築物能夠歷久不衰","綠建築的設計以人為原點，必須能住得舒服","D","3","(A)使用消耗最少地球能源及資源的建材來設計(B)進行全面性、系統性的設計(C)以具有生態、節能，健康特性與減廢的特性為主","TRUE"
"lesson8-第八課-陋室銘-22","lesson8","第八課 陋室銘","第八課 陋室銘","「窮苦的物質生活使我居住在狹小髒亂的違建，但是對我來說，這卻像是皇宮一樣舒適，因為我無時無刻不專注於自我的修養。」這兩句話的意思與下列何者最接近？","一枝草，一點露","君子居之，何陋之有","登高必自卑，行遠必自邇","欲窮千里目，更上一層樓","B","1","題幹強調物質環境雖然狹小髒亂，但因專注於自我修養而感到舒適，意思最接近「君子居之，何陋之有」，故選(B)。(A)強調天無絕人之路，(C)強調循序漸進，(D)強調登高望遠，都不合題意。","TRUE"
"lesson8-第八課-陋室銘-23","lesson8","第八課 陋室銘","第八課 陋室銘","「寧為小人之所罵，毋為君子之所鄙。」這句話的寓意，與下列何者最接近？","美德與羞辱是不能相容的","堅持正道，絕不從眾媚俗","凡事率性而為，毋須盡如人意","人有準繩規矩，才知平直方圓","B","1","題幹「寧為……，毋為……」表示一種價值的選擇，「寧為小人之所罵」所以絕不從眾媚俗，「毋為君子之所鄙」所以必須堅持正道。故選(B)","TRUE"
"lesson8-第八課-陋室銘-24","lesson8","第八課 陋室銘","第八課 陋室銘","下列借代詞語的運用，何者不正確？","李博士在大學執教多年，桃李滿天下，堪稱「杏壇」之光","「祝融」肆虐，不但屋倒路毀，連魚塭裡的虱目魚也全部流失","劉大姊憑百萬資金創業，不到十年，便成為直銷界的龍頭，真是「巾幗」不讓鬚眉","王大明熱心公益，敢衝敢說，常常代替勞工向資方爭取權益，是「藍領」階級的代言人","B","1","(B)「祝融」借代為火或火災，與句意不合","TRUE"
"lesson8-第八課-陋室銘-25","lesson8","第八課 陋室銘","第八課 陋室銘","(甲)陋室「銘」(乙)愛蓮「說」(丙)有恆「箴」。請問上述「 」中的文體，何者作用最相近？","甲乙","乙丙","甲丙","甲乙丙","C","2","(甲)銘：用以記述功德或警戒自勉的文字(乙)說：用來闡述某種道理或主張的文章(丙)箴：以表達規勸性質為主題","TRUE"